[
 {
  "finding_id": "house1-aggregate-20140917T1700",
  "site_id": "house1",
  "channel": "aggregate",
  "category": "spike",
  "start_ts": "2014-09-17T16:00:00+00:00",
  "detected_ts": "2014-09-17T17:00:00+00:00",
  "end_ts": "2014-09-17T17:00:00+00:00",
  "excess_kwh": 0.3637,
  "rm_per_month": 0.0,
  "confidence": 0.542,
  "title": "Burst of extra household usage",
  "explanation": "The whole-house meter used 0.36 kWh more than its day-ahead forecast over 1 hours from Wed 17 Sep 2014 17:00 (UK time), before returning to normal. The meter shows the pattern, not which device caused it.",
  "possible_causes": [],
  "action": "Look back at what was running at that time and whether it needed to be.",
  "source": "live",
  "status": "open"
 },
 {
  "finding_id": "house1-aggregate-20140921T2000",
  "site_id": "house1",
  "channel": "aggregate",
  "category": "spike",
  "start_ts": "2014-09-21T14:00:00+00:00",
  "detected_ts": "2014-09-21T20:00:00+00:00",
  "end_ts": "2014-09-21T22:00:00+00:00",
  "excess_kwh": 3.2659,
  "rm_per_month": 0.0,
  "confidence": 0.614,
  "title": "Burst of extra household usage",
  "explanation": "The whole-house meter used 3.27 kWh more than its day-ahead forecast over 8 hours from Sun 21 Sep 2014 15:00 (UK time), before returning to normal. The meter shows the pattern, not which device caused it.",
  "possible_causes": [],
  "action": "Look back at what was running at that time and whether it needed to be.",
  "source": "live",
  "status": "open"
 },
 {
  "finding_id": "house1-aggregate-20141008T2000",
  "site_id": "house1",
  "channel": "aggregate",
  "category": "spike",
  "start_ts": "2014-10-08T19:00:00+00:00",
  "detected_ts": "2014-10-08T20:00:00+00:00",
  "end_ts": "2014-10-11T00:00:00+00:00",
  "excess_kwh": 8.4977,
  "rm_per_month": 0.0,
  "confidence": 1.0,
  "title": "Burst of extra household usage",
  "explanation": "The whole-house meter used 8.50 kWh more than its day-ahead forecast over 2.2 days from Wed 08 Oct 2014 20:00 (UK time), before returning to normal. The meter shows the pattern, not which device caused it.",
  "possible_causes": [],
  "action": "Look back at what was running at that time and whether it needed to be.",
  "source": "live",
  "status": "open"
 },
 {
  "finding_id": "house1-aggregate-20141012T1500",
  "site_id": "house1",
  "channel": "aggregate",
  "category": "spike",
  "start_ts": "2014-10-12T10:00:00+00:00",
  "detected_ts": "2014-10-12T15:00:00+00:00",
  "end_ts": "2014-10-13T00:00:00+00:00",
  "excess_kwh": 5.3341,
  "rm_per_month": 0.0,
  "confidence": 0.792,
  "title": "Burst of extra household usage",
  "explanation": "The whole-house meter used 5.33 kWh more than its day-ahead forecast over 14 hours from Sun 12 Oct 2014 11:00 (UK time), before returning to normal. The meter shows the pattern, not which device caused it.",
  "possible_causes": [],
  "action": "Look back at what was running at that time and whether it needed to be.",
  "source": "live",
  "status": "open"
 },
 {
  "finding_id": "house1-aggregate-20141017T1300",
  "site_id": "house1",
  "channel": "aggregate",
  "category": "spike",
  "start_ts": "2014-10-17T09:00:00+00:00",
  "detected_ts": "2014-10-17T13:00:00+00:00",
  "end_ts": "2014-10-17T20:00:00+00:00",
  "excess_kwh": 1.7911,
  "rm_per_month": 0.0,
  "confidence": 0.625,
  "title": "Burst of extra household usage",
  "explanation": "The whole-house meter used 1.79 kWh more than its day-ahead forecast over 11 hours from Fri 17 Oct 2014 10:00 (UK time), before returning to normal. The meter shows the pattern, not which device caused it.",
  "possible_causes": [],
  "action": "Look back at what was running at that time and whether it needed to be.",
  "source": "live",
  "status": "open"
 },
 {
  "finding_id": "house1-aggregate-20141019T2300",
  "site_id": "house1",
  "channel": "aggregate",
  "category": "spike",
  "start_ts": "2014-10-19T22:00:00+00:00",
  "detected_ts": "2014-10-19T23:00:00+00:00",
  "end_ts": "2014-10-20T20:00:00+00:00",
  "excess_kwh": 4.2078,
  "rm_per_month": 0.0,
  "confidence": 0.792,
  "title": "Burst of extra household usage",
  "explanation": "The whole-house meter used 4.21 kWh more than its day-ahead forecast over 22 hours from Sun 19 Oct 2014 23:00 (UK time), before returning to normal. The meter shows the pattern, not which device caused it.",
  "possible_causes": [],
  "action": "Look back at what was running at that time and whether it needed to be.",
  "source": "live",
  "status": "open"
 },
 {
  "finding_id": "house1-aggregate-20141024T0400",
  "site_id": "house1",
  "channel": "aggregate",
  "category": "spike",
  "start_ts": "2014-10-24T03:00:00+00:00",
  "detected_ts": "2014-10-24T04:00:00+00:00",
  "end_ts": "2014-10-24T06:00:00+00:00",
  "excess_kwh": 1.2378,
  "rm_per_month": 0.0,
  "confidence": 0.583,
  "title": "Burst of extra household usage",
  "explanation": "The whole-house meter used 1.24 kWh more than its day-ahead forecast over 3 hours from Fri 24 Oct 2014 04:00 (UK time), before returning to normal. The meter shows the pattern, not which device caused it.",
  "possible_causes": [],
  "action": "Look back at what was running at that time and whether it needed to be.",
  "source": "live",
  "status": "open"
 },
 {
  "finding_id": "house1-aggregate-20141121T0800",
  "site_id": "house1",
  "channel": "aggregate",
  "category": "spike",
  "start_ts": "2014-11-21T07:00:00+00:00",
  "detected_ts": "2014-11-21T08:00:00+00:00",
  "end_ts": "2014-11-21T09:00:00+00:00",
  "excess_kwh": 1.9396,
  "rm_per_month": 0.0,
  "confidence": 0.583,
  "title": "Burst of extra household usage",
  "explanation": "The whole-house meter used 1.94 kWh more than its day-ahead forecast over 2 hours from Fri 21 Nov 2014 07:00 (UK time), before returning to normal. The meter shows the pattern, not which device caused it.",
  "possible_causes": [],
  "action": "Look back at what was running at that time and whether it needed to be.",
  "source": "live",
  "status": "open"
 },
 {
  "finding_id": "house1-aggregate-20141123T1700",
  "site_id": "house1",
  "channel": "aggregate",
  "category": "gradual_drift",
  "start_ts": "2014-11-23T15:00:00+00:00",
  "detected_ts": "2014-11-23T17:00:00+00:00",
  "end_ts": "2014-12-03T08:00:00+00:00",
  "excess_kwh": 56.9211,
  "rm_per_month": 0.0,
  "confidence": 1.0,
  "title": "Usage creeping up day by day",
  "explanation": "The whole-house meter used 56.92 kWh more than its day-ahead forecast over 9.7 days from Sun 23 Nov 2014 15:00 (UK time), before returning to normal. The meter shows the pattern, not which device caused it.",
  "possible_causes": [],
  "action": "Compare this week's habits and devices with a few weeks ago to find what changed.",
  "source": "live",
  "status": "open"
 },
 {
  "finding_id": "house1-aggregate-20141213T0200",
  "site_id": "house1",
  "channel": "aggregate",
  "category": "gradual_drift",
  "start_ts": "2014-12-13T00:00:00+00:00",
  "detected_ts": "2014-12-13T02:00:00+00:00",
  "end_ts": "2014-12-25T07:00:00+00:00",
  "excess_kwh": 120.3713,
  "rm_per_month": 0.0,
  "confidence": 1.0,
  "title": "Usage creeping up day by day",
  "explanation": "The whole-house meter used 120.37 kWh more than its day-ahead forecast over 12.3 days from Sat 13 Dec 2014 00:00 (UK time), before returning to normal. The meter shows the pattern, not which device caused it.",
  "possible_causes": [],
  "action": "Compare this week's habits and devices with a few weeks ago to find what changed.",
  "source": "live",
  "status": "open"
 },
 {
  "finding_id": "house1-aggregate-20141229T0300",
  "site_id": "house1",
  "channel": "aggregate",
  "category": "baseload_creep",
  "start_ts": "2014-12-29T01:00:00+00:00",
  "detected_ts": "2014-12-29T03:00:00+00:00",
  "end_ts": "2014-12-31T11:00:00+00:00",
  "excess_kwh": 19.1487,
  "rm_per_month": 0.0,
  "confidence": 1.0,
  "title": "Always-on usage has stepped up",
  "explanation": "The whole-house meter used 19.15 kWh more than its day-ahead forecast over 2.4 days from Mon 29 Dec 2014 01:00 (UK time), before returning to normal. The meter shows the pattern, not which device caused it.",
  "possible_causes": [],
  "action": "Read the meter when everything should be off and compare with a normal week.",
  "source": "live",
  "status": "open"
 },
 {
  "finding_id": "house1-aggregate-20150105T0600",
  "site_id": "house1",
  "channel": "aggregate",
  "category": "gradual_drift",
  "start_ts": "2015-01-05T01:00:00+00:00",
  "detected_ts": "2015-01-05T06:00:00+00:00",
  "end_ts": "2015-03-05T21:00:00+00:00",
  "excess_kwh": 473.2434,
  "rm_per_month": 0.0,
  "confidence": 1.0,
  "title": "Usage creeping up day by day",
  "explanation": "The whole-house meter used 473.24 kWh more than its day-ahead forecast over 59.8 days from Mon 05 Jan 2015 01:00 (UK time), before returning to normal. The meter shows the pattern, not which device caused it.",
  "possible_causes": [],
  "action": "Compare this week's habits and devices with a few weeks ago to find what changed.",
  "source": "live",
  "status": "open"
 },
 {
  "finding_id": "house1-aggregate-20150309T0100",
  "site_id": "house1",
  "channel": "aggregate",
  "category": "overnight_excess",
  "start_ts": "2015-03-09T00:00:00+00:00",
  "detected_ts": "2015-03-09T01:00:00+00:00",
  "end_ts": "2015-03-12T06:00:00+00:00",
  "excess_kwh": 16.1935,
  "rm_per_month": 0.0,
  "confidence": 1.0,
  "title": "Extra usage overnight",
  "explanation": "The whole-house meter used 16.19 kWh more than its day-ahead forecast over 3.2 days from Mon 09 Mar 2015 00:00 (UK time), before returning to normal. The meter shows the pattern, not which device caused it.",
  "possible_causes": [],
  "action": "Do a walk-round after bedtime and switch off anything running that doesn't need to be.",
  "source": "live",
  "status": "open"
 },
 {
  "finding_id": "house1-aggregate-20150319T0100",
  "site_id": "house1",
  "channel": "aggregate",
  "category": "spike",